{
  "pipeline_schema": "0.1.0",
  "id": "animatic",
  "description": "Every capability, including procedural recipes, produced by labelled placeholders: review timing, layout and mix structure before anything expensive runs.",
  "verification": "CI (rendered on every push)",
  "providers": {
    "placeholder": {
      "type": "placeholder"
    }
  },
  "routes": {
    "speech": "placeholder",
    "voice_conversion": "placeholder",
    "music": "placeholder",
    "sound": "placeholder",
    "image": "placeholder",
    "video": "placeholder",
    "typing": "placeholder",
    "render_3d": "placeholder",
    "procedural": "placeholder"
  }
}
