{
  "pipeline_schema": "0.1.0",
  "id": "kokoro-fastapi",
  "description": "Kokoro-82M narration through Kokoro-FastAPI's OpenAI-compatible endpoint (docker run -p 8880:8880 ghcr.io/remsky/kokoro-fastapi-cpu); other capabilities are placeholders.",
  "verification": "unverified example: protocol covered by tests against a local fake server, not a live Kokoro-FastAPI",
  "extends": "animatic",
  "providers": {
    "kokoro": {
      "type": "openai-compatible",
      "config": {
        "capabilities": [
          "speech"
        ],
        "base_url": "http://localhost:8880/v1",
        "model_id": "kokoro",
        "response_format": "wav",
        "model": {
          "name": "Kokoro-82M",
          "license": "Apache-2.0",
          "source": "https://huggingface.co/hexgrad/Kokoro-82M"
        },
        "notes": "Kokoro-82M weights and voices are published as Apache-2.0; confirm on the model card, then add output_rights."
      }
    }
  },
  "routes": {
    "speech": "kokoro"
  },
  "voices": {
    "default": "af_heart",
    "narrator": "af_heart",
    "narrator_male": "am_michael"
  }
}
